{
  "schema_version": "1.0.0",
  "request_id": "req-ha-exec-002",
  "status": "succeeded",
  "timestamp": "2026-10-11T22:45:02Z",
  "result": {
    "entity_id": "light.living_room_ceiling",
    "action": "turn_on",
    "accepted": true,
    "observed_state": "on",
    "state_confirmed": true,
    "state_changed": true,
    "physical_action_confirmed": null
  },
  "execution_duration_ms": 2040
}
