{
  "schema_version": "1.0.0",
  "request_id": "req-rem-create-005",
  "status": "succeeded",
  "timestamp": "2026-10-11T22:45:15Z",
  "result": {
    "reminder_id": "rem-daily-standup",
    "title": "Team daily standup meeting",
    "due_at": "2026-10-12T10:00:00Z",
    "status": "scheduled",
    "created_at": "2026-10-11T22:45:15Z"
  },
  "execution_duration_ms": 15
}
